source,period,rate_pct,denominator,url,note
IRP Commerce Market Data,2026 market-data page accessed 2026-06-07,1.56,transactions / sessions,https://www.irpcommerce.com/en/gb/ecommercemarketdata.aspx,External e-commerce session-level benchmark; denominator differs from the case-study user-level any-Yes label.
Shopify retail conversion benchmark summary,article accessed 2026-06-07,1.6,lower bound of typical online retail conversion-rate range,https://www.shopify.com/blog/retail-conversion-rate,Reported as a typical low-end online retail benchmark in Shopify's summary.
Shopify retail conversion benchmark summary,article accessed 2026-06-07,3.0,upper bound of common online retail conversion-rate range,https://www.shopify.com/blog/retail-conversion-rate,"Used as a conservative upper-range comparator, not as an exact sector match."
Case-study raw touchpoint data,2025-02-10 to 2025-02-11,49.44,Yes touchpoints / all touchpoints,data/sql_outputs/rq123_touchpoint_features.csv,SQL row-level label prevalence; not an e-commerce session purchase rate.
Case-study reconstructed user journeys,2025-02-10 to 2025-02-11,83.63189322093432,users with any Yes touchpoint / users,data/sql_outputs/rq123_journey_features.csv,Inflated by the SQL any-Yes label rule and not directly comparable to session-level e-commerce benchmarks.
Case-study stricter journey label,2025-02-10 to 2025-02-11,49.49069195644538,users whose final touchpoint is Yes / users,data/sql_outputs/rq123_journey_features.csv,"A stricter SQL-generated internal alternative, still much higher than external e-commerce purchase benchmarks."
